<?xml version="1.0" encoding="ISO-8859-1"?>
<!DOCTYPE algorithm PUBLIC "" "LiSA.dtd">
<algorithm xmlns:LiSA="http://lisa.math.uni-magdeburg.de" name="Simulated Annealing" type="iterative" call="nb_iter" code="external" help_file="algorithm/nb_iter_SA_english.html">
  <heuristic>
    <problem>
      <alpha env="O"/>
      <beta/>
      <gamma objective="Cmax"/>
    </problem>
    <problem>
      <alpha env="O"/>
      <beta/>
      <gamma objective="Lmax"/>
    </problem>
    <problem>
      <alpha env="O"/>
      <beta/>
      <gamma objective="Sum_Ci"/>
    </problem>
    <problem>
      <alpha env="O"/>
      <beta/>
      <gamma objective="Sum_wiCi"/>
    </problem>
    <problem>
      <alpha env="O"/>
      <beta/>
      <gamma objective="Sum_Ui"/>
    </problem>
    <problem>
      <alpha env="O"/>
      <beta/>
      <gamma objective="Sum_wiUi"/>
    </problem>
    <problem>
      <alpha env="O"/>
      <beta/>
      <gamma objective="Sum_Ti"/>
    </problem>
    <problem>
      <alpha env="O"/>
      <beta/>
      <gamma objective="Sum_wiTi"/>
    </problem>
    <problem>
      <alpha env="O"/>
      <beta release_times="yes"/>
      <gamma objective="Cmax"/>
    </problem>
    <problem>
      <alpha env="O"/>
      <beta release_times="yes"/>
      <gamma objective="Lmax"/>
    </problem>
    <problem>
      <alpha env="O"/>
      <beta release_times="yes"/>
      <gamma objective="Sum_Ci"/>
    </problem>
    <problem>
      <alpha env="O"/>
      <beta release_times="yes"/>
      <gamma objective="Sum_wiCi"/>
    </problem>
    <problem>
      <alpha env="O"/>
      <beta release_times="yes"/>
      <gamma objective="Sum_Ui"/>
    </problem>
    <problem>
      <alpha env="O"/>
      <beta release_times="yes"/>
      <gamma objective="Sum_wiUi"/>
    </problem>
    <problem>
      <alpha env="O"/>
      <beta release_times="yes"/>
      <gamma objective="Sum_Ti"/>
    </problem>
    <problem>
      <alpha env="O"/>
      <beta release_times="yes"/>
      <gamma objective="Sum_wiTi"/>
    </problem>
  </heuristic>
  <alg_controls>
    <real name="TSTART" caption="Start temperature" default="20"/>
    <real name="TEND" caption="End temperature" default="0.9"/>
    <choice name="COOLSCHEME" caption="Cooling scheme">
      <item name="LINEAR"/>
      <item name="GEOMETRIC"/>
      <item name="LUNDYANDMEES"/>
    </choice>
    <real name="COOLPARAM" caption="Cooling parameter" default="0.0005"/>
    <integer name="EPOCH" caption="Epoch length" default="100"/>
    <integer name="NUMB_NGHB" caption="Number of neighbors" 
default="1"/>
    <integer name="STEPS" caption="Iteration steps" default="50000"/>
    <integer name="NUMB_STUCKS" caption="Abort when stuck for (stopping criterion)" 
default="100000"/>
    <real name="ABORT_BOUND" caption="Abort when reaching objective (stopping criterion)" default="0"/>
    <integer name="k" caption="k for k_API or k_REINSERTION" default="3"/>
    <choice name="NGBH" caption="Neighborhood">
      <item name="CR_TST"/>
      <item name="k_API"/>
      <item name="SHIFT"/>
      <item name="PI"/>
      <item name="CR_API"/>
      <item name="BL_API"/>
      <item name="CR_SHIFT"/>
      <item name="BL_SHIFT"/>
      <item name="3_CR"/>
      <item name="k_REINSERTION"/>
    </choice>
    <fixed name="METHOD" value="SimulatedAnnealingNew"/>
    <fixed name="TYPE" value="RAND"/>
  </alg_controls>
</algorithm>
