<?xml version="1.0" encoding="ISO-8859-1"?>
<!DOCTYPE algorithm PUBLIC "" "LiSA.dtd">
<algorithm xmlns:LiSA="http://lisa.math.uni-magdeburg.de" name="Beam Ant Colony" type="constructive" call="beam_aco" code="external" help_file="algorithm/beam_aco.html">
  <heuristic>
    <problem>
      <alpha env="O"/>
      <beta/>
      <gamma objective="Cmax"/>
    </problem>
    <problem>
      <alpha env="O"/>
      <beta/>
      <gamma objective="Sum_Ci"/>
    </problem>
  </heuristic>
  <alg_controls>
    <integer name="BEAM_WIDTH" caption="Beam width" default="100"/>
    <real name="LOWER_BOUND" caption="Lower bound" default="0"/>
    <real name="UPPER_BOUND" caption="Upper bound" default="1e+06"/>
    <choice name="EXTENSION_STRATEGY" caption="Determination of beam extensions">
      <item name="MED"/>
      <item name="LDS"/>
      <item name="FIXED"/>
    </choice>
    <integer name="FIXED_KEXT" caption="Number of beam extensions" default="10"/>
    <choice name="APPEND_STRATEGY" caption="Strategy of selection of extensions">
      <item name="ORIGINAL"/>
      <item name="SORTED"/>
      </choice>
    <choice name="PRE_SELECTION" caption="Pre-selection of extensions">
      <item name="NONE"/>
      <item name="ACTIVE"/>
     </choice>
    <integer name="STEPS" caption="Number of runs" default="50"/>
    <real name="CONVERGENCE_FACTOR" caption="Convergence factor for re-start" default="0.98"/>
    <real name="EVAPORATION_RATE" caption="Evaporation rate" default="0.3"/>
    <real name="WEIGHT_EST" caption="Influence of Earliest Completion Time" default="1"/>
  <real name="WEIGHT_TIJ" caption="Influence of pheromone values" default="1"/>
  <real name="WEIGHT_RAND" caption="Influence of randomness" default="1"/>

  </alg_controls>
</algorithm>
