<?xml version="1.0" encoding="ISO-8859-1"?>
<!DOCTYPE algorithm PUBLIC "" "LiSA.dtd">
<algorithm xmlns:LiSA="http://lisa.math.uni-magdeburg.de" name="Partition alg. (Research)" type="constructive" call="partition" code="external" help_file="algorithm/partition.html">
  <exact>
    <problem>
      <alpha env="O" m="2"/>
      <beta/>
      <gamma objective="Cmax"/>
    </problem>
    <problem>
      <alpha env="P" m="2"/>
      <beta/>
      <gamma objective="Cmax"/>
    </problem>
  </exact>
  <alg_controls/>
</algorithm>
