<?xml version="1.0" encoding="ISO-8859-1"?>
<!DOCTYPE algorithm PUBLIC "" "LiSA.dtd">
<algorithm xmlns:LiSA="http://lisa.math.uni-magdeburg.de" name="Brucker's Open-Shop B&amp;B" type="constructive" call="os_bb_wo" code="external" help_file="algorithm/os_bb_wo.html">
  <exact>
    <problem>
      <alpha env="O"/>
      <beta/>
      <gamma objective="Cmax"/>
    </problem>
  </exact>
  <alg_controls>
    <choice name="HEURISTIC" caption="Heuristik">
      <!-- these heuristics do not work for non partial operation sets 
      <item name="MIN_MATCHING"/>
      <item name="MAX_MATCHING"/>
      <item name="MIN_BOTTLE_MATCHING"/>
      <item name="MAX_BOTTLE_MATCHING"/>      
      <item name="MIN_BOTTLE_MATCHING_VAR"/>
      <item name="MAX_BOTTLE_MATCHING_VAR"/> -->
      <item name="LB_PREC_RULE"/>
      <item name="LB_PREC_RULE_VAR"/>
    </choice>
  </alg_controls>
</algorithm>
