<?xml version="1.0" encoding="ISO-8859-1"?>
<!DOCTYPE instance PUBLIC "" "LiSA.dtd">
<instance xmlns:LiSA="http://lisa.math.uni-magdeburg.de">
 <problem>
    <alpha env="O"/>
    <beta/>
    <gamma objective="Sum_wiCi"/>
  </problem>
  <values m="4" n="3">
    <processing_times model="lisa_native">{ 
 {  38  25  48 12 } 
 {   9  65  23 11 } 
 {  25  59  82 5 } 
} 
</processing_times>
    <operation_set model="lisa_native">{ 
 {   1   1   1   1 } 
 {   1   1   1   1 } 
 {   1   1   1   1 } 
} 
</operation_set>
  </values>
</instance>
