<?xml version="1.0" encoding="ISO-8859-1"?>
<!DOCTYPE algorithm PUBLIC "" "LiSA.dtd">
<algorithm xmlns:LiSA="http://lisa.math.uni-magdeburg.de" name="Matching Heuristiken" type="constructive" call="match" code="external" help_file="algorithm/match.html">
  <heuristic>
    <problem>
      <alpha env="O"/>
      <beta/>
      <gamma objective="Cmax"/>
    </problem>
    <problem>
      <alpha env="O"/>
      <beta/>
      <gamma objective="Sum_Ci"/>
    </problem>
  </heuristic>
  <alg_controls>
    <choice name="TYPEOF" caption="Art des Algorithmus :">
      <item name="BOTTLENECK"/>
      <item name="WEIGHTED"/>
    </choice>
    <choice name="MINMAX" caption="Art des Matchings :">
      <item name="HEADS"/>
      <item name="MIN"/>
      <item name="MAX"/>
    </choice>
  </alg_controls>
</algorithm>
