<?xml version="1.0" encoding="ISO-8859-1"?>
<!DOCTYPE solution PUBLIC "" "../data/LiSA.dtd">
<solution xmlns:LiSA="http://lisa.math.uni-magdeburg.de">
  <problem>
    <alpha env="O"/>
    <beta/>
    <gamma objective="Cmax"/>
  </problem>
  <values m="10" n="10">
    <processing_times model="lisa_native">{
 { 48 59 41 27 46 4 32 3 79 90 }
 { 17 97 42 33 84 30 83 52 87 51 }
 { 95 44 34 92 6 86 83 60 90 36 }
 { 90 13 43 76 33 91 98 17 68 85 }
 { 44 98 76 24 20 81 29 76 1 89 }
 { 10 16 93 88 78 73 99 97 18 92 }
 { 49 67 34 19 6 47 54 63 65 30 }
 { 90 11 48 20 34 73 74 87 28 14 }
 { 57 6 78 94 25 56 15 2 33 91 }
 { 77 19 17 44 28 88 55 42 92 32 }
}
</processing_times>
    <operation_set model="lisa_native">{
 { 1 1 1 1 1 1 1 1 1 1 }
 { 1 1 1 1 1 1 1 1 1 1 }
 { 1 1 1 1 1 1 1 1 1 1 }
 { 1 1 1 1 1 1 1 1 1 1 }
 { 1 1 1 1 1 1 1 1 1 1 }
 { 1 1 1 1 1 1 1 1 1 1 }
 { 1 1 1 1 1 1 1 1 1 1 }
 { 1 1 1 1 1 1 1 1 1 1 }
 { 1 1 1 1 1 1 1 1 1 1 }
 { 1 1 1 1 1 1 1 1 1 1 }
}
</operation_set>
  </values>
  <schedule m="10" n="10" semiactive="yes">
    <plan model="lisa_native">{
 { 4 6 3 13 2 7 1 12 14 15 }
 { 6 5 11 10 8 12 2 14 7 1 }
 { 1 10 4 6 17 8 11 15 3 13 }
 { 13 14 9 3 4 5 10 2 1 12 }
 { 11 1 10 15 14 13 16 6 12 2 }
 { 8 9 12 1 11 14 5 4 2 10 }
 { 7 12 8 9 10 2 3 11 15 4 }
 { 12 13 2 14 1 3 6 5 9 11 }
 { 9 4 1 5 16 10 15 3 8 6 }
 { 2 11 15 16 6 1 14 13 10 5 }
}
</plan>
    <completion_times model="lisa_native">{
 { 220 290 167 518 80 303 32 491 597 689 }
 { 248 231 494 452 419 525 134 615 335 51 }
 { 95 480 230 350 681 436 563 675 196 599 }
 { 674 687 374 164 197 299 474 85 68 559 }
 { 494 98 450 650 626 606 679 371 503 187 }
 { 312 328 612 88 519 685 302 203 106 441 }
 { 297 588 331 369 425 135 189 488 662 219 }
 { 584 599 126 619 34 208 376 295 410 455 }
 { 439 104 78 258 658 495 633 87 382 349 }
 { 172 521 635 694 279 88 618 563 502 251 }
}
</completion_times>
  </schedule>
</solution>
